<?xml version="1.0" encoding="utf-8"?>
<!--
  ~ org.riverock.portlet - Portlet Library
  ~
  ~ Copyright (C) 2006, Riverock Software, All Rights Reserved.
  ~
  ~ Riverock - The Open-source Java Development Community
  ~ http://www.riverock.org
  ~
  ~
  ~ This program is free software; you can redistribute it and/or
  ~ modify it under the terms of the GNU General Public
  ~ License as published by the Free Software Foundation; either
  ~ version 2 of the License, or (at your option) any later version.
  ~
  ~ This library is distributed in the hope that it will be useful,
  ~ but WITHOUT ANY WARRANTY; without even the implied warranty of
  ~ MERCHANTABILITY or FITNESS FOR A PARTICULAR PURPOSE. See the GNU
  ~ General Public License for more details.
  ~
  ~ You should have received a copy of the GNU General Public
  ~ License along with this library; if not, write to the Free Software
  ~ Foundation, Inc., 59 Temple Place, Suite 330, Boston, MA 02111-1307 USA
  -->
<action-config xmlns:xsi="http://www.w3.org/2001/XMLSchema-instance" xsi:noNamespaceSchemaLocation="C:\sandbox\riverock\riverock-module\src-schema\xsd\riverock-module-action.xsd">
	<default-action>home</default-action>
	<role>webmill.guest</role>
	<role>webmill.root</role>
	<default-forward name="error" path="/riverock/register/jsp/action-message.jsp"/>
	<default-forward name="system-error" path="/riverock/register/jsp/action-message.jsp"/>

    <action name="Help action" path="help" default-forward="/riverock/register/jsp/help.jsp" type="org.riverock.portlet.register.action.RegisterHelpAction"/>

	<action name="Home action" path="home" default-forward="/riverock/register/jsp/home.jsp" type="org.riverock.portlet.register.action.RegisterHomeAction"/>

	<action name="Send password action" path="send-password" type="org.riverock.portlet.register.action.SendPasswordAction">
		<forward name="ok" path="/riverock/register/jsp/send-password-ok.jsp"/>
<!--
		<forward name="error" path="/riverock/register/jsp/send-password-error.jsp"/>
-->
        <forward name="error" path="/riverock/register/jsp/home.jsp"/>
	</action>

	<action name="Create account action" path="create-account" type="org.riverock.portlet.register.action.CreateAccountAction">
		<forward name="ok" path="/riverock/register/jsp/create-account-ok.jsp"/>
<!--
		<forward name="error" path="/riverock/register/jsp/create-account-error.jsp"/>
-->
		<forward name="error" path="/riverock/register/jsp/home.jsp"/>
	</action>
</action-config>
